eA,eA_Pattern,eA_Name,eA_Content,mA,mA_Pattern,mA_Unit,mA_from,mA_value,mA_to,t_Pattern,t_factor,t_from,t_value,t_to,c_Pattern,c_Name,c_factor,eB,eB_Pattern,eB_Name,eB_Content,mB,mB_Pattern,mB_Unit,mB_from,mB_value,mB_to,c,t
i,at nunc,eu nibh quisque,imperdiet sapien urna pretium nisl ut,r,cubilia curae duis,m,642.06,582.8,591.59,maecenas ut massa,4.95,353.6,879.1,719.77,semper sapien,accumsan tortor quis,3.94,p,in,morbi sem mauris,ridiculus mus vivamus vestibulum sagittis sapien cum,s,vivamus vel nulla,m,666.09,180.39,975.93,ip,rs
p,lacinia,ut ultrices,luctus et ultrices posuere cubilia curae donec,s,sem mauris,USD,92.65,413.59,357.22,volutpat eleifend donec ut,7.86,175.69,472.41,760.16,consequat,interdum mauris,5.64,r,vel,duis consequat dui,ut nunc vestibulum ante ipsum primis in,s,eget tincidunt eget,m,967.41,441.2,745.17,pr,ss
r,ligula in,aenean auctor,duis bibendum felis sed interdum venenatis,r,ipsum primis,%,52.22,455.73,655.31,vestibulum sagittis sapien,6.13,875.9,608.7,898.07,nulla,interdum mauris,8.08,p,primis in,nunc commodo placerat,dolor sit amet consectetuer adipiscing elit proin,r,dolor vel,kg,827.11,91.01,62.55,rp,rr
p,nunc rhoncus,nullam sit amet,eros suspendisse accumsan tortor quis turpis sed,i,sit amet lobortis,kg,395.74,343.69,926.11,faucibus orci luctus et,2.78,967.44,433.43,293.4,eget,ipsum primis in,6.0,o,aenean sit,leo rhoncus sed,sed sagittis nam congue risus semper porta,s,aenean lectus,kg,572.12,414.39,14.21,po,is
s,suspendisse accumsan,consequat nulla,sed tristique in tempus sit amet,o,erat eros viverra,USD,519.87,349.85,806.32,molestie lorem quisque ut,6.17,512.48,451.28,265.82,ultrices,condimentum id luctus nec,3.08,s,orci luctus,et magnis,sit amet turpis elementum ligula vehicula consequat,r,interdum venenatis,USD,767.04,261.57,400.83,ss,or
r,rhoncus,nascetur ridiculus,praesent lectus vestibulum quam sapien,i,adipiscing lorem vitae,%,54.71,928.2,889.66,mollis molestie lorem quisque,4.95,859.32,457.96,63.41,sit,luctus cum sociis natoque,7.19,o,suspendisse,auctor sed,maecenas tincidunt lacus at velit vivamus vel,i,pellentesque ultrices,m,709.93,899.69,386.17,ro,ii
r,morbi quis,sem mauris laoreet,vestibulum ante ipsum primis in faucibus,o,sollicitudin vitae consectetuer,%,76.18,299.91,712.14,vestibulum rutrum rutrum neque,4.49,560.76,489.79,760.17,eget,posuere cubilia curae,9.57,r,condimentum,blandit nam,at turpis donec posuere metus vitae ipsum,o,rhoncus sed vestibulum,USD,140.16,899.96,968.5,rr,oo
p,urna,id ligula suspendisse,sagittis sapien cum sociis natoque penatibus,p,nulla ut,kg,385.15,207.72,898.97,curabitur in libero,0.95,651.38,122.45,736.9,at velit,turpis a,2.43,r,dolor quis,curabitur at,mauris sit amet eros suspendisse accumsan tortor,p,praesent id massa,m,633.36,929.77,426.26,pr,pp
o,nunc,suspendisse potenti,proin leo odio porttitor id,i,odio donec,%,808.21,340.76,833.55,sollicitudin vitae consectetuer,9.3,821.45,874.62,552.19,rhoncus,turpis nec euismod scelerisque,5.68,o,in imperdiet,curabitur gravida,at vulputate vitae nisl aenean lectus pellentesque,s,dui vel sem,kg,227.86,156.57,838.41,oo,is
o,vitae,ac tellus,mi sit amet lobortis sapien,r,platea dictumst,%,968.33,128.14,201.18,rhoncus sed vestibulum,4.06,234.34,205.74,318.79,consequat lectus,phasellus in felis donec,9.35,s,lorem quisque,a odio in,suscipit a feugiat et eros vestibulum ac,o,in quam fringilla,USD,9.79,601.15,517.24,os,ro
i,in sapien,in libero ut,morbi porttitor lorem id ligula suspendisse,r,rutrum nulla,%,181.5,797.25,594.25,justo maecenas rhoncus,0.63,397.33,72.26,910.69,odio,vehicula condimentum curabitur in,0.28,p,adipiscing,venenatis tristique,vel augue vestibulum rutrum rutrum neque aenean,r,vestibulum eget,kg,247.41,920.37,369.2,ip,rr
r,eu pede,curabitur gravida nisi,aliquam convallis nunc proin at turpis,o,lectus aliquam,kg,329.99,494.4,708.86,morbi vestibulum velit,6.41,318.24,550.72,540.2,eu tincidunt,sem sed,1.18,r,mus,suscipit a,velit eu est congue elementum in hac,p,orci luctus et,USD,133.19,366.96,542.54,rr,op
p,amet nulla,tortor sollicitudin,convallis nunc proin at turpis a pede,o,vulputate vitae nisl,kg,110.88,759.42,993.15,nisl duis ac,5.07,485.65,763.93,403.15,arcu,vitae ipsum aliquam,2.53,p,lacinia aenean,eget tincidunt,non quam nec dui luctus rutrum nulla,r,diam erat,kg,903.15,633.62,828.39,pp,or
i,sed nisl,mus vivamus vestibulum,blandit mi in porttitor pede justo,i,et ultrices posuere,%,145.4,575.8,234.33,mauris vulputate elementum nullam,3.53,513.13,759.1,362.51,ut ultrices,semper rutrum,9.22,p,integer,luctus ultricies eu,non mauris morbi non lectus aliquam sit,p,phasellus in,USD,972.72,627.15,217.18,ip,ip
p,vivamus vel,integer aliquet massa,quam nec dui luctus rutrum nulla,s,consequat in consequat,m,17.48,814.69,794.55,mauris enim leo rhoncus,1.13,371.48,246.89,837.01,diam,id justo,8.68,p,feugiat non,accumsan tortor,bibendum imperdiet nullam orci pede venenatis non,r,habitasse platea,m,233.07,615.8,321.26,pp,sr
i,curabitur,cras mi,dapibus duis at velit eu,s,auctor gravida,kg,381.34,526.94,302.06,duis mattis egestas,6.13,479.8,64.58,362.48,quis justo,sollicitudin ut suscipit a,8.74,r,odio,libero nam dui,luctus et ultrices posuere cubilia curae donec,r,pellentesque ultrices mattis,kg,694.82,499.43,964.04,ir,sr
i,convallis,vel pede morbi,orci luctus et ultrices posuere,r,lobortis vel,USD,98.21,840.64,596.68,vestibulum sagittis sapien cum,0.2,216.45,306.74,42.68,duis mattis,et eros vestibulum,9.94,r,natoque penatibus,sociis natoque penatibus,cum sociis natoque penatibus et magnis dis,s,ut nunc,USD,753.22,259.41,310.96,ir,rs
p,a feugiat,ipsum ac tellus,id justo sit amet sapien dignissim,p,placerat ante,m,84.5,438.26,375.15,consequat metus sapien,8.33,742.7,976.26,593.7,mollis,ut rhoncus aliquet,8.75,r,condimentum curabitur,euismod scelerisque quam,massa donec dapibus duis at velit eu,p,erat fermentum justo,m,12.4,28.41,358.82,pr,pp
i,penatibus,aliquam erat,erat tortor sollicitudin mi sit amet lobortis,s,id turpis,kg,405.7,680.1,852.98,quis lectus suspendisse,7.22,406.27,107.41,633.38,vestibulum sit,morbi quis tortor id,9.05,r,id justo,aliquam erat volutpat,phasellus sit amet erat nulla tempus vivamus,s,imperdiet nullam,m,556.63,912.15,286.5,ir,ss
r,eleifend quam,sociis natoque penatibus,semper est quam pharetra magna ac consequat,s,integer aliquet,kg,630.9,799.49,535.72,hac habitasse platea,2.09,792.18,116.53,65.22,dis,curae nulla,2.14,s,commodo vulputate,dapibus duis,ipsum praesent blandit lacinia erat vestibulum sed,s,donec pharetra magna,m,564.21,210.1,547.44,rs,ss
s,leo rhoncus,elementum eu,commodo vulputate justo in blandit ultrices enim,r,metus aenean,kg,469.96,303.88,905.81,in faucibus orci,0.96,803.18,832.85,257.15,a,eleifend donec,7.98,o,est donec,consequat in,montes nascetur ridiculus mus etiam vel augue,i,vivamus tortor,%,412.36,312.18,662.86,so,ri
p,erat tortor,primis in,ullamcorper purus sit amet nulla quisque,r,lobortis vel dapibus,kg,268.38,998.54,813.41,risus dapibus augue vel,6.13,401.84,857.14,206.4,est lacinia,sollicitudin mi sit amet,7.3,p,id,venenatis non sodales,suscipit a feugiat et eros vestibulum ac,i,rutrum nulla,USD,52.79,195.13,188.72,pp,ri
p,platea dictumst,est et,amet sem fusce consequat nulla nisl nunc,r,in hac,USD,12.06,309.31,199.06,eu interdum eu,9.01,502.32,68.63,380.04,nibh,in sapien,6.2,s,augue vel,vitae nisi nam,sed vestibulum sit amet cursus id turpis,p,bibendum felis,%,120.12,166.26,295.39,ps,rp
i,odio,cursus id,convallis duis consequat dui nec nisi volutpat,r,cursus urna,USD,469.05,598.7,311.98,eget eros elementum,9.9,472.82,867.56,190.37,ligula,neque sapien placerat,3.5,o,mi,sit amet,vitae quam suspendisse potenti nullam porttitor lacus,o,eu nibh,kg,658.49,72.69,710.34,io,ro
s,posuere nonummy,ac diam,turpis nec euismod scelerisque quam turpis,s,orci vehicula condimentum,m,242.0,963.98,409.88,praesent blandit lacinia erat,9.52,193.87,116.96,46.21,amet nulla,nulla ac enim,0.64,p,ipsum,eros vestibulum,morbi ut odio cras mi pede malesuada,i,vel sem,%,886.54,601.93,195.96,sp,si
o,at turpis,amet justo morbi,et magnis dis parturient montes,s,libero quis orci,%,318.97,255.78,998.7,in faucibus orci,5.58,18.6,310.38,628.33,parturient montes,dui nec nisi volutpat,0.92,o,vel sem,cum sociis natoque,id mauris vulputate elementum nullam varius nulla,s,amet sapien,m,330.69,321.18,634.02,oo,ss
p,potenti,turpis eget,in consequat ut nulla sed,p,sed justo,USD,243.52,186.33,275.93,rutrum rutrum neque aenean,3.32,329.08,762.0,605.76,amet sapien,nam dui,1.87,o,pede,aliquet massa id,vestibulum ante ipsum primis in faucibus orci,o,amet diam,m,62.8,890.24,216.09,po,po
p,facilisi cras,bibendum morbi,mauris eget massa tempor convallis,o,luctus rutrum nulla,USD,824.57,373.45,420.01,fermentum donec ut,1.62,378.66,11.17,741.07,nibh in,vel accumsan,9.89,o,tempus,et magnis dis,nulla ultrices aliquet maecenas leo odio condimentum,s,fusce posuere,kg,307.41,850.85,201.3,po,os
s,volutpat eleifend,curabitur gravida nisi,nibh fusce lacus purus aliquet at feugiat,i,imperdiet sapien,kg,203.84,537.29,311.14,quis lectus suspendisse potenti,5.89,970.66,395.54,910.3,elit ac,nulla justo,6.44,r,aenean lectus,sed tincidunt eu,primis in faucibus orci luctus et ultrices,i,in blandit,m,125.27,855.83,803.56,sr,ii
o,suscipit,urna pretium nisl,condimentum curabitur in libero ut massa,p,bibendum imperdiet,%,544.33,543.18,646.14,posuere cubilia curae nulla,1.77,241.98,46.04,342.84,bibendum,rhoncus dui vel,5.01,r,dapibus,metus arcu adipiscing,nulla nisl nunc nisl duis bibendum felis,p,velit nec nisi,%,144.47,957.77,146.7,or,pp
r,sollicitudin,ligula nec sem,non mattis pulvinar nulla pede ullamcorper,p,aliquet maecenas leo,kg,270.28,993.47,130.3,ac lobortis vel dapibus,9.15,737.06,833.6,957.37,est,cursus urna ut tellus,3.66,i,quis tortor,dictumst maecenas,elit sodales scelerisque mauris sit amet eros,o,sed ante,%,674.21,139.85,42.12,ri,po
r,sed nisl,justo eu massa,purus sit amet nulla quisque,o,convallis nunc proin,kg,146.58,220.5,915.88,felis fusce posuere,1.56,303.84,706.76,997.17,sem,duis aliquam,0.77,o,justo in,facilisi cras,sit amet cursus id turpis integer aliquet,p,duis mattis egestas,m,228.69,987.63,399.85,ro,op
s,dui nec,justo in blandit,justo lacinia eget tincidunt eget tempus vel,i,odio donec,m,465.76,398.22,833.87,leo rhoncus sed,9.99,6.26,852.4,138.77,tincidunt,semper interdum,4.49,i,lacus at,nulla mollis,eu est congue elementum in hac habitasse,s,tristique est et,%,625.15,729.93,876.65,si,is
p,porta volutpat,amet justo,est lacinia nisi venenatis tristique,i,potenti nullam porttitor,kg,712.54,806.45,621.45,accumsan odio curabitur convallis,5.46,214.61,936.42,447.6,proin risus,mi integer ac neque,0.57,r,id sapien,suspendisse potenti,rutrum neque aenean auctor gravida sem praesent,p,congue vivamus metus,kg,417.27,800.73,772.41,pr,ip
r,odio,elit proin,in hac habitasse platea dictumst aliquam,o,velit vivamus,USD,367.08,966.08,878.19,ullamcorper purus sit,5.99,210.85,974.27,911.08,odio,lacus curabitur at ipsum,9.72,o,primis in,sapien cursus vestibulum,ultrices posuere cubilia curae mauris viverra diam,p,sagittis nam congue,m,457.56,181.13,326.39,ro,op
i,odio elementum,morbi quis tortor,consequat morbi a ipsum integer a,o,odio justo sollicitudin,kg,333.4,897.83,898.86,congue eget semper rutrum,7.68,681.89,677.5,91.17,quis libero,ante ipsum,7.71,o,vivamus in,pellentesque ultrices,maecenas ut massa quis augue luctus tincidunt,s,consequat ut,%,320.58,711.02,322.54,io,os
p,odio,vulputate justo in,eros vestibulum ac est lacinia nisi venenatis,r,donec dapibus duis,kg,185.43,374.7,542.14,quis augue luctus tincidunt,9.6,803.91,479.97,15.06,neque libero,nibh fusce lacus purus,5.99,i,donec,primis in,convallis tortor risus dapibus augue vel accumsan,s,ipsum dolor sit,m,935.81,713.16,998.92,pi,rs
i,sapien,porta volutpat,neque libero convallis eget eleifend,p,amet eros,kg,423.54,590.42,724.12,nunc vestibulum ante ipsum,6.95,107.32,991.08,14.0,hac,ut erat id,1.65,p,sollicitudin vitae,vestibulum velit id,nunc proin at turpis a pede posuere,o,odio porttitor,%,990.85,389.78,58.93,ip,po
i,nec sem,id massa id,mus etiam vel augue vestibulum rutrum,o,feugiat non pretium,m,400.93,487.86,631.37,viverra dapibus nulla,4.58,906.67,621.58,395.59,amet consectetuer,diam id,4.5,s,pede,lacus morbi quis,tempus vel pede morbi porttitor lorem id,o,luctus rutrum,m,179.57,586.48,510.69,is,oo
o,duis at,leo odio condimentum,libero quis orci nullam molestie nibh,r,eget nunc donec,%,786.59,910.7,326.36,eu tincidunt in leo,5.59,501.03,139.31,915.61,condimentum id,amet cursus id,9.24,i,vel lectus,purus eu magna,libero convallis eget eleifend luctus ultricies eu,s,ut erat,kg,755.99,255.74,630.18,oi,rs
i,quis,pellentesque volutpat,potenti nullam porttitor lacus at turpis donec,s,curae donec,kg,878.24,945.64,465.62,eleifend donec ut,1.47,599.51,836.03,781.4,laoreet ut,dolor sit amet,6.89,o,at,cubilia curae,vulputate luctus cum sociis natoque penatibus et,r,vestibulum ante ipsum,kg,173.17,259.48,258.47,io,sr
s,ipsum,ac neque duis,consequat varius integer ac leo,p,at turpis,kg,763.48,690.91,417.45,tellus in sagittis dui,4.73,414.37,547.26,51.26,porta,porttitor pede justo,7.05,s,metus sapien,odio odio,accumsan odio curabitur convallis duis consequat dui,r,magna at,m,911.2,844.29,359.96,ss,pr
r,ut tellus,massa tempor,at nunc commodo placerat praesent blandit nam,o,augue luctus tincidunt,USD,856.18,4.48,295.22,augue quam sollicitudin,5.78,496.09,593.84,310.72,nisi,venenatis non,9.57,r,nunc,in purus,amet sem fusce consequat nulla nisl nunc,i,rhoncus mauris,USD,350.37,324.8,663.02,rr,oi
i,justo sit,pede lobortis,malesuada in imperdiet et commodo vulputate justo,i,adipiscing elit proin,m,675.72,9.39,681.51,integer aliquet massa,5.72,754.45,654.23,71.56,ante nulla,sapien ut nunc,9.03,s,quam pharetra,quam pede lobortis,accumsan felis ut at dolor quis odio,p,dapibus augue,%,167.49,367.89,949.11,is,ip
s,odio cras,faucibus accumsan,urna pretium nisl ut volutpat,p,mauris eget massa,m,235.88,530.33,849.16,molestie nibh in lectus,7.29,893.69,569.68,94.19,eleifend donec,orci luctus,2.15,o,duis faucibus,mauris viverra,dui proin leo odio porttitor id consequat,p,pede venenatis non,%,820.45,595.42,123.58,so,pp
o,non pretium,sit amet sem,augue quam sollicitudin vitae consectetuer eget rutrum,r,amet eleifend pede,USD,234.79,311.45,882.51,sit amet consectetuer,5.43,279.23,655.37,688.78,rhoncus aliquam,duis consequat dui,9.11,s,tellus,lorem vitae mattis,ipsum primis in faucibus orci luctus et,o,rutrum rutrum,kg,913.08,35.78,454.83,os,ro
s,rutrum,nunc proin at,libero nam dui proin leo odio porttitor,r,eget tincidunt,USD,384.82,451.69,165.87,id ornare imperdiet sapien,9.44,294.34,536.51,757.72,a,non mi integer,7.81,s,est congue,mollis molestie,iaculis congue vivamus metus arcu adipiscing molestie,i,metus sapien ut,kg,392.62,630.67,795.09,ss,ri
i,nisi,et ultrices posuere,cras pellentesque volutpat dui maecenas tristique,o,libero ut,m,823.3,488.54,403.96,aenean sit amet justo,7.0,233.7,852.92,472.86,pede ac,justo pellentesque viverra pede,7.33,r,mus,fringilla rhoncus,risus auctor sed tristique in tempus sit,r,ante ipsum primis,m,191.29,311.99,53.15,ir,or
s,felis donec,consectetuer adipiscing elit,potenti in eleifend quam a odio,r,sociis natoque penatibus,USD,660.6,662.76,805.86,erat nulla tempus,7.72,377.66,35.46,69.51,adipiscing,magna ac,9.8,o,condimentum id,erat id mauris,eu mi nulla ac enim in tempor,r,pretium iaculis diam,%,868.63,856.07,986.7,so,rr
i,in,ac nulla sed,eget tempus vel pede morbi,s,ut tellus nulla,%,810.66,255.59,885.63,id turpis integer,0.58,867.83,82.52,348.33,tempor convallis,adipiscing elit,9.57,o,sed,scelerisque mauris sit,at feugiat non pretium quis lectus suspendisse,o,pellentesque ultrices,m,173.17,638.1,436.32,io,so
s,vivamus metus,ante vivamus,sollicitudin vitae consectetuer eget rutrum,s,lacus at,kg,68.12,716.7,218.75,tincidunt eu felis,0.67,358.38,102.72,165.32,vestibulum proin,a ipsum,1.95,o,felis eu,nec nisi volutpat,elit sodales scelerisque mauris sit amet eros,o,sagittis nam,%,542.72,939.65,474.87,so,so
o,varius,accumsan odio curabitur,purus phasellus in felis donec semper sapien,s,eu orci mauris,m,806.37,162.91,334.13,quis orci eget,3.47,25.99,937.17,116.78,ac,vestibulum ante ipsum,3.98,i,rhoncus,nulla ut erat,convallis nulla neque libero convallis eget eleifend,s,curabitur convallis,%,595.41,578.95,15.52,oi,ss
r,interdum venenatis,tempus vivamus in,quisque erat eros viverra eget congue,i,lectus vestibulum,m,837.86,941.01,794.56,maecenas tristique est,5.73,509.9,591.08,177.56,augue vestibulum,rutrum neque aenean auctor,0.51,i,vestibulum,vestibulum velit id,dui vel nisl duis ac nibh fusce,o,nonummy maecenas tincidunt,%,81.88,790.6,684.23,ri,io
p,semper interdum,mattis odio,amet nulla quisque arcu libero rutrum,s,vestibulum aliquet ultrices,m,104.68,980.39,544.67,congue vivamus metus arcu,3.33,337.62,343.02,603.91,curae duis,justo maecenas rhoncus,2.36,p,felis,volutpat convallis morbi,etiam justo etiam pretium iaculis justo in,o,egestas metus aenean,USD,951.76,599.62,520.02,pp,so
s,adipiscing elit,aliquet at feugiat,dignissim vestibulum vestibulum ante ipsum primis,o,morbi non quam,m,563.58,497.46,887.76,morbi odio odio elementum,4.97,716.41,647.42,858.15,vitae,pede malesuada in,8.83,o,pellentesque ultrices,dui maecenas tristique,sem duis aliquam convallis nunc proin at,s,amet nulla quisque,m,492.08,617.23,538.64,so,os
i,ligula suspendisse,elementum in hac,enim in tempor turpis nec euismod,r,elit proin risus,USD,789.51,400.79,282.79,eu orci mauris lacinia,9.22,882.58,833.67,252.75,enim,blandit non interdum in,8.7,r,eu,risus semper porta,sed justo pellentesque viverra pede ac diam,p,maecenas tincidunt,%,392.53,67.45,33.47,ir,rp
r,at,massa tempor,vitae mattis nibh ligula nec sem duis,o,ut at dolor,%,174.13,456.37,524.21,lacus at velit,0.13,931.18,32.65,0.97,in,nascetur ridiculus mus,8.96,i,sed,quam nec,blandit ultrices enim lorem ipsum dolor sit,i,libero convallis,kg,156.17,365.11,5.5,ri,oi
r,quam a,in quis,arcu libero rutrum ac lobortis,p,nam tristique,kg,956.48,118.21,469.57,morbi non quam,5.03,445.79,650.98,279.71,curae mauris,nulla nunc purus phasellus,9.81,p,ridiculus,ac lobortis,pellentesque ultrices mattis odio donec vitae nisi,r,condimentum curabitur,kg,877.18,727.65,392.15,rp,pr
p,volutpat,maecenas ut,libero non mattis pulvinar nulla pede ullamcorper,r,volutpat sapien arcu,USD,558.03,182.14,667.7,faucibus orci luctus et,6.48,8.84,736.75,897.08,auctor gravida,elit sodales,7.38,o,felis,orci luctus,fusce congue diam id ornare imperdiet sapien,p,odio odio,m,364.03,454.22,338.67,po,rp
i,curabitur,odio elementum eu,vel est donec odio justo sollicitudin,o,orci nullam molestie,kg,899.08,430.95,202.58,a pede posuere nonummy,2.93,653.47,682.85,458.71,vestibulum,felis ut at dolor,8.39,o,morbi porttitor,enim lorem ipsum,a ipsum integer a nibh in quis,r,tempus vivamus,m,877.11,230.04,270.15,io,or
p,ut,suspendisse potenti,quam pharetra magna ac consequat metus,p,consequat ut nulla,m,840.68,788.05,515.93,at ipsum ac tellus,1.39,288.46,376.2,170.61,tristique,libero rutrum,5.74,o,in,sociis natoque penatibus,magna ac consequat metus sapien ut nunc,o,at feugiat,USD,920.27,507.66,747.86,po,po
s,a odio,quis turpis,condimentum id luctus nec molestie,s,commodo vulputate justo,m,472.5,585.75,666.47,dui nec nisi,7.5,653.49,625.21,823.17,ultrices posuere,odio consequat varius integer,8.68,r,turpis eget,mauris eget massa,felis ut at dolor quis odio consequat,r,tortor id,%,704.29,403.23,927.06,sr,sr
p,non,imperdiet et,platea dictumst morbi vestibulum velit,s,turpis elementum,kg,509.0,210.44,932.79,aliquet massa id lobortis,2.59,99.96,605.97,880.73,ligula nec,ac enim,7.74,r,et ultrices,ante vel,mauris vulputate elementum nullam varius nulla facilisi,i,praesent blandit,%,513.29,503.38,667.2,pr,si
s,ultrices,ut mauris eget,est phasellus sit amet erat nulla,r,porttitor lorem id,%,350.44,945.27,333.39,tellus in sagittis dui,3.93,139.94,374.58,496.64,morbi,tristique tortor,3.16,s,leo rhoncus,orci vehicula condimentum,mi pede malesuada in imperdiet et commodo,p,lorem ipsum dolor,kg,543.92,139.61,5.0,ss,rp
o,a,ipsum integer a,vestibulum velit id pretium iaculis diam,o,natoque penatibus et,%,389.18,469.01,960.13,in blandit ultrices enim,2.33,496.26,743.4,193.46,felis,augue vestibulum,3.88,o,metus arcu,ut ultrices vel,porttitor lacus at turpis donec posuere metus,o,mattis pulvinar,%,216.72,900.72,190.64,oo,oo
o,leo,ut volutpat sapien,vestibulum sed magna at nunc commodo,r,justo nec,USD,397.12,263.83,169.37,dictumst maecenas ut,1.44,573.18,837.44,669.3,tempus semper,curae donec,8.86,p,vel dapibus,id justo sit,sed vel enim sit amet nunc viverra,i,ut dolor morbi,kg,287.48,263.33,796.51,op,ri
r,posuere,diam neque vestibulum,at velit vivamus vel nulla eget eros,s,libero ut massa,USD,524.05,831.48,370.63,et magnis dis parturient,6.82,498.91,147.82,473.27,et magnis,in quis justo,5.86,i,nam,lobortis est phasellus,non mauris morbi non lectus aliquam sit,r,ligula suspendisse ornare,m,294.08,526.47,906.64,ri,sr
s,et,vestibulum velit,orci luctus et ultrices posuere cubilia,p,leo rhoncus,m,676.87,78.95,690.81,aliquam non mauris,2.95,425.93,926.08,184.21,habitasse platea,vivamus in,0.03,s,nisi,eu pede,est congue elementum in hac habitasse platea,s,purus sit,m,830.5,354.25,618.5,ss,ps
r,ut,eget eros elementum,erat curabitur gravida nisi at nibh in,o,ultrices phasellus id,m,997.6,260.59,837.49,ut nunc vestibulum,6.76,479.64,636.17,852.16,platea dictumst,est phasellus,1.73,r,ut erat,at nulla suspendisse,tempus sit amet sem fusce consequat nulla,i,turpis adipiscing,m,944.31,35.96,480.48,rr,oi
o,justo,ipsum ac tellus,rutrum nulla nunc purus phasellus,i,nullam porttitor,m,383.94,699.94,62.1,convallis eget eleifend luctus,6.87,513.97,469.12,755.32,dolor sit,neque libero convallis eget,9.41,p,metus arcu,sagittis dui vel,justo etiam pretium iaculis justo in hac,r,donec ut mauris,%,109.99,267.02,567.39,op,ir
r,consequat,faucibus orci luctus,hac habitasse platea dictumst etiam faucibus,o,at vulputate,kg,520.3,946.23,480.66,molestie hendrerit at vulputate,3.19,606.44,822.12,99.81,curabitur,laoreet ut,3.95,p,in tempus,sit amet eleifend,eget rutrum at lorem integer tincidunt ante,s,ultrices enim lorem,kg,496.46,437.3,354.1,rp,os
s,risus praesent,est risus,duis at velit eu est,r,vel pede,%,103.62,768.85,678.04,nulla nunc purus,4.07,494.95,370.91,317.04,libero,sed accumsan,3.9,o,proin interdum,hendrerit at vulputate,sagittis sapien cum sociis natoque penatibus et,i,vivamus in felis,USD,70.91,829.77,899.29,so,ri
o,faucibus orci,suspendisse potenti,est lacinia nisi venenatis tristique fusce,p,rhoncus sed,USD,97.24,17.79,805.41,cursus vestibulum proin,4.24,61.68,211.08,712.77,eget,nulla integer pede justo,5.92,r,eu orci,hac habitasse,nullam varius nulla facilisi cras non velit,i,duis bibendum,kg,590.07,623.16,951.26,or,pi
s,id pretium,libero quis,ridiculus mus vivamus vestibulum sagittis,p,id consequat in,%,320.97,677.79,449.15,adipiscing elit proin risus,6.15,872.52,178.46,55.7,penatibus,neque vestibulum,2.16,i,amet sem,convallis nulla neque,morbi sem mauris laoreet ut rhoncus aliquet,s,turpis a pede,USD,193.7,343.12,21.67,si,ps
o,ridiculus,scelerisque mauris,morbi ut odio cras mi pede malesuada,s,nisl duis ac,m,874.92,925.34,152.26,aliquet pulvinar sed,3.37,822.16,536.4,492.29,lacus curabitur,ipsum primis in faucibus,4.33,o,volutpat,molestie lorem,suspendisse potenti cras in purus eu magna,o,sapien sapien non,kg,698.4,554.73,842.76,oo,so
s,donec,augue vel,ipsum praesent blandit lacinia erat vestibulum sed,p,proin eu,USD,772.79,940.83,700.72,habitasse platea dictumst,3.85,283.26,506.17,105.8,nulla tempus,sit amet,0.87,p,eget congue,aliquam augue quam,ultrices libero non mattis pulvinar nulla pede,i,pellentesque ultrices,m,430.84,390.21,965.3,sp,pi
p,egestas,amet lobortis sapien,mauris ullamcorper purus sit amet,i,posuere cubilia curae,USD,281.98,183.46,719.59,sed interdum venenatis,4.83,53.21,989.16,682.51,luctus nec,velit id,4.38,r,fermentum,orci mauris,sed tincidunt eu felis fusce posuere felis,s,pellentesque viverra,%,71.81,811.99,174.49,pr,is
p,eget,lacus at,duis aliquam convallis nunc proin,o,vestibulum aliquet,kg,339.4,933.98,232.96,purus aliquet at feugiat,0.13,357.0,60.64,953.65,maecenas,sed tristique in tempus,1.46,p,potenti nullam,non velit nec,vel accumsan tellus nisi eu orci mauris,p,a nibh,kg,243.94,595.42,102.96,pp,op
o,pede posuere,mauris enim leo,orci mauris lacinia sapien quis libero nullam,o,in quam fringilla,%,253.72,961.36,950.08,non interdum in,7.48,531.47,556.59,359.23,pede ullamcorper,enim lorem,2.96,o,mauris vulputate,cursus urna,ipsum primis in faucibus orci luctus et,p,in felis eu,USD,73.55,421.6,407.64,oo,op
p,nulla,justo eu,ligula nec sem duis aliquam convallis nunc,r,dapibus augue,m,80.94,624.82,260.38,porta volutpat quam,4.62,664.83,381.07,788.32,cras,aliquam non mauris morbi,5.54,p,rhoncus dui,justo nec,tortor quis turpis sed ante vivamus tortor,o,faucibus orci luctus,kg,702.13,538.69,851.63,pp,ro
s,convallis,sapien quis,vestibulum quam sapien varius ut blandit non,s,ut volutpat sapien,USD,69.72,392.85,621.38,aliquam augue quam,6.24,394.11,571.74,261.66,sed justo,aliquet ultrices,8.62,i,orci,mus vivamus,libero ut massa volutpat convallis morbi odio,s,fusce lacus,kg,176.59,501.59,173.45,si,ss
i,placerat,volutpat in congue,erat fermentum justo nec condimentum neque,s,sit amet eleifend,m,508.85,23.18,879.14,sapien sapien non,3.75,227.5,726.8,712.47,consequat,ut at dolor,7.38,s,nulla sed,non velit nec,amet cursus id turpis integer aliquet massa,r,tempus vivamus,%,413.66,74.02,591.29,is,sr
r,est,eu orci mauris,magna vulputate luctus cum sociis natoque penatibus,r,volutpat sapien arcu,m,590.16,376.88,227.68,nam congue risus,7.02,445.32,431.31,297.19,est,nam congue risus semper,5.63,p,sed magna,morbi ut,amet nunc viverra dapibus nulla suscipit ligula,p,rutrum at lorem,m,391.66,949.06,562.91,rp,rp
